id,number,title,office_marker_info,official_url,description,county,location_info,latitude,longitude,created_at,updated_at
66,66,Jacobville,<p>STATE HISTORICAL MARKER No. 66</p><p>STATE HISTORIC PRESERVATION OFFICE</p><p>AUSTIN CHAMBER OF COMMERCE</p>,http://nvshpo.org/historical-markers/66,"<p>The site of Jacobsville is one-half mile north. George Washington Jacobs, the first sheriff of Lander County, founded the town on the banks of the Reese River in 1859.  Jacobsville was the Overland Stage and mail station and became a Pony Express stop in 1860. In the early 1860s, it had a population of about 400 people and boasted of having the first telegraph relay station, a post office, courthouse, three stores and two hotels.</p><p>Jacobsville was the first county seat of Lander County, then comprising practically all of northeastern Nevada.  The county seat was moved to the more populated town of Austin the same year it was established in Jacobsville.  The only remnants of the town are a few stones used in the foundations.  The Reese River, just west of here, was discovered by the exploring party of John Reese in 1854.</p>",Lander," Humboldt River Basin, Lander County Located on U.S. Highway 50, six miles west of Austin, Nevada.",39.29343,-117.1102,2014-11-01 19:06:38 UTC,2014-11-07 00:40:36 UTC
67,67,Austin Churches,<p>STATE HISTORICAL MARKER No. 67</p><p>STATE HISTORIC PRESERVATION OFFICE</p><p>AUSTIN CHAMBER OF COMMERCE</p>,http://nvshpo.org/historical-markers/67,"<p>St. George’s Episcopal Church, to the east, was consecrated in 1878.  The Reverend Blackiston used an eloquent, enthusiastic Easter sermon in 1877 to secure pledges for a church, retaining wall, pipe organ, and bell and for a twenty dollar gold piece from every employee of a local mine.  The organ was shipped around the Horn and hauled by wagon from San Francisco.</p><p>St. Augustine’s Catholic Church, to the west, was built in 1866 of native brick and stone.  Father Monteverde, the first pastor, conducted the first mass at midnight, Christmas Eve, 1866.  Admission of $1 per person was charged to limit the number of people attending.</p><p>The Methodist Church, to the north, was built in 1866. A canny minister formed the Methodist Company, and sold stock as far away as the East Coast to finance the building of the church. Lectures and entertainment were part of the church scene for benefit purposes.  Emma Wixom attended Sunday school here.  Later, as world-famous Emma Nevada, she brought her troupe to Austin and gave a benefit concert in the church.</p>",Lander," Humboldt River Basin, Lander County. Located on U.S. Highway 50 in Austin, Nevada.",0.0,0.0,2014-11-01 19:06:38 UTC,2014-11-07 00:40:36 UTC
68,68,Wadsworth,<p>STATE HISTORICAL MARKER No. 68</p><p>STATE HISTORIC PRESERVATION OFFICE</p>,http://nvshpo.org/historical-markers/68,"<p>From 1868 until 1884, the Central Pacific’s Truckee Wadsworth Division was located on this site.  In 1882, work was started on a new site across the river, and by 1883, a new round house, shop, etc. were completed there.  A fire on April 15, 1884, fanned by heavy wind, destroyed the remaining railroad buildings as well as the town. Damage exceeded $100,000.  Lack of an adequate water supply contributed to the extensive damage.  Another fire in 1902 stimulated the plan to move to a new site.  In 1904, division facilities in the town were moved to an entirely new location, which became Sparks, Nevada.</p><p>SNOWSHOE THOMPSON CHAPTER NO. 1827, E. CLAMPUS VITUS</p>",Washoe,"Truckee River Basin, Washoe County Located adjacent to the Southern Pacific Railroad in Wadsworth, Nevada, at the ""Big Bend"" of the lower Truckee River.",39.16282,-119.50446,2014-11-01 19:06:38 UTC,2014-11-07 00:40:36 UTC
69,69,Jarbidge,<p>STATE HISTORICAL MARKER No. 69</p><p>STATE HISTORIC PRESERVATION OFFICE</p><p>NORTHEASTERN NEVADA HISTORICAL SOCIETY</p>,http://nvshpo.org/historical-markers/69,"<p>As early as 10,000 years ago, Native American hunting parties camped near here to hunt game.  About a thousand years ago, Shoshone-speaking people entered the region, where they continue to live today.  The name Jarbidge comes from a Shoshone word meaning “a bad or evil spirit.”</p><p>Dave Bourne discovered gold in this isolated area in 1909, and production eventually totaled $9 million.  Population size varied, but in the early 1920s, the Jarbidge district replaced fading Goldfield as the premier gold-producing area in Nevada. The Jarbidge mines failed beginning in the late 1920s.</p><p>On a stormy December 5, 1916, the last stagecoach robbery and murder in the history of the West took place in Jarbidge Canyon, ¼ mile south of the town.</p>",Elko," Snake River Basin, Elko County Located in the Children's Pake in Jarbidge, Nevada.",40.50383,-114.1227,2014-11-01 19:06:38 UTC,2014-11-06 15:11:57 UTC
70,70,Bliss Mansion,<p>STATE HISTORICAL MARKER No. 70</p><p>STATE HISTORICAL PRESERVATION OFFICE</p><p>NEVADA LANDMARK SOCIETY</p>,http://nvshpo.org/historical-markers/70,<p>Daniel L. Bliss built this extravagant home in 1879.  Bliss had made his fortune providing Tahoe lumber to the Comstock Mining District.  Tradition maintains this was the first house in Nevada entirely piped for gas lighting.</p>,Carson City," Carson River Basin, Carson City. Located at the intersection of Mountain and Robinson Streets, Carson City.",39.16725,-119.77205,2014-11-01 19:06:38 UTC,2014-11-07 00:40:36 UTC
71,71,Methodist Church of Carson City,<p>STATE HISTORICAL MARKER No. 71</p><p>STATE HISTORIC PRESERVATION OFFICE</p><p>NEVADA LANDMARK SOCIETY</p>,http://nvshpo.org/historical-markers/71,"<p>Dedicated in 1867, this church serves a congregation that dates to 1859.  Like many other buildings in Carson City, the stone used in its construction was quarried at the nearby State Prison.  Reverend Warren Nims (Pastor 1863-1866) was responsible for much of the original construction.  Altered extensively over the years, the structure, with its octagonal porch posts and pointed-arch windows, is one of Nevada’s oldest religious structures.</p>",Carson City," Carson River Basin, Carson City. Located at the intersection of Division and Musser Streets, Carson City.",39.16461,-119.76954,2014-11-01 19:06:38 UTC,2014-11-07 00:40:36 UTC
72,72,Nevada State Children's Home,<p>STATE HISTORICAL MARKER No. 72</p><p>COMMEMORATING A CENTURY OF STATE SERVICE TO THE CHILDREN OF NEVADA</p><p>CARSON CITY HISTORICAL COMMISION</p><p>STATE HISTORIC PRESERVATION OFFICE</p>,http://nvshpo.org/historical-markers/72,"<p>The Nevada Orphans’ Asylum, a privately funded institution, was opened in Virginia City in 1864 by the Daughters of Charity.  By 1870 most of its functions were taken over by the Nevada State Orphans’ Home at Carson City, authorized in 1869 by the legislature and constructed on this site.  The first child was admitted October 28, 1870.</p><p>In 1903, the first building gave way to a larger one, constructed of sandstone from the state prison quarry east of Carson City.  This edifice served until 1963 as Nevada’s home for dependent and neglected children. In 1951, its name was changed to the Nevada State Children’s Home.</p><p>The stone building was in turn replaced in 1963, in accordance with the modern concept of family-sized groups housed in cottages.  The facility closed in 1992.</p>",Carson City," Carson River Basin, Carson City. Located at the intersection of Stewart and Fifth Streets, Carson City.",39.09601,-119.45863,2014-11-01 19:06:38 UTC,2014-11-07 00:40:36 UTC
73,73,Unknown Soldiers,<p>STATE HISTORICAL MARKER No. 73</p><p>STATE HISTORIC PRESERVATION OFFICE</p>,http://nvshpo.org/historical-markers/73,"<p>Victims of the influenza epidemic of 1918, ten soldiers died and were buried here without identity.  During World War I, troop trains ran regularly through Montello.  As soldiers became ill enroute, they were unloaded at the nearest hospitals.  The Southern Pacific Railroad kept a doctor at Montello who checked every train enroute.  Ill passengers were treated in a makeshift hospital at the town’s hotel.</p><p>The graves were unmarked for years but through the persistent efforts of Mr. and Mrs. Kimber of Montello, and the 40 & 8 of Las Vegas, the previously unmarked graves, although still unidentified as to name, were marked in 1975.</p><p>Unfortunately, fires had destroyed the original government records, making identification impossible.</p><p>S.D. PETERS</p>",Elko," Great Salt Lake Basin, Elko County. Located in the cemetery at Motello, on State Route 223 twenty-three miles north of Interstate Highway 80.",41.2618,-114.19335,2014-11-01 19:06:38 UTC,2014-11-06 15:11:57 UTC
74,74,Wellington,<p>STATE HISTORICAL MARKER No. 74</p><p>STATE HISTORIC PRESERVATION OFFICE</p>,http://nvshpo.org/historical-markers/74,"<p>Following the mining boom in the Aurora District in 1860, Jack Wright and Leonard Hamilton put up a bridge across the West Walker River and established a stage station at this location.  Wagons and stages were repaired, and horses shod. The station soon became a trading center for nearby ranches and farms.</p><p>In 1863, Daniel Wellington bought the interests of Wright and Hamilton and the station became known as “Wellington’s.”  The Wellington Hotel, located about a half mile south of the station, was constructed by wagonmaster Zadok Pierce in 1875.  Over the years it has served as a livery stable, freight station, general store, and post office.</p>",Lyon,"",38.45069,-119.22139,2014-11-01 19:06:38 UTC,2014-11-07 00:40:36 UTC
75,75,Government Building (1888-1970),"<p>STATE HISTORICAL MARKER No. 75</p>
<p>state historic preservation office</p><p>Carson City Historical Commission</p>",http://nvshpo.org/historical-markers/75,"<p>This imposing public structure, the former United States Post Office and Courthouse, represents the first federal office building constructed in the State of Nevada.  Construction began in late 1888 and was completed in 1891 at a cost of $134,605.53.</p><p>Designed by Mifflin E. Bell, Supervising Architect of the Treasury Department, the building incorporates many elements of the Romanesque Revival style.  Subsequent interior designs were made by Bell’s successors, Will Frost and James Windrum.</p><p>Thomas P. Hawley was the first United States District Judge to preside in Carson City.  The last federal judge to officiate here was Bruce R. Thompson whose court was moved to Reno, August 1965.</p><p>This building ceased to serve as a post office in 1970 with William E. Dunfield as Postmaster.  Deeded to the State in 1971 and listed on the National Register of Historic Places in 1979, the Government Building continues to serve the public.</p>",Carson City," Carson River Basin, Carson City. Located at North Carson and Telegraph Streets, Carson City.",39.16613,-119.76679,2014-11-01 19:06:38 UTC,2014-11-06 15:11:58 UTC
76,76,Eagle Valley,"<p>STATE HISTORICAL MARKER No. 76</p><p>STATE HISTORICAL PRESERVATION OFFICE</p>
<p>OVERLAND ACRES ASSOCIATION</p>",http://nvshpo.org/historical-markers/76,"<p>Centrally located between one of the first Nevada settlements at Genoa and the gold and silver of the Comstock Lode, Eagle Valley, site of present Carson City, was a vital link in land communications.</p><p>One of the key California emigrant routes, the Carson branch of the California emigrant Trail crossed the Sierra Nevada at Kit Carson Pass and came through Eagle Valley roughly along Sage Drive, a block east of this point.</p><p>The first overland telegraph, colloquially known as Fred Bee’s “Grapevine,” was completed from Placerville to Carson City in 1859.  In this area, it followed what is now highway U.S. 395.  The Pony Express (1860-1861) and the Butterfield-Wells-Fargo Overland Stages (1862-1868) followed the same route.</p><p>The Virginia & Truckee Railway in its extension to Carson Valley and Minden in 1906 used the route of Bigelow Drive six blocks east.</p>",Carson City," Carson River Basin, Carson City. Located at Oak and California Streets, Carson City.",39.12479,-119.76759,2014-11-01 19:06:38 UTC,2014-11-07 00:40:36 UTC
77,77,Dat-So-La-Lee,"<p>STATE HISTORICAL MARKER No. 77</p><p>STATE HISTORIC PRESERVATION OFFICE</p>
<p>RENO CHAPTER, DAUGHTERS OF THE AMERICAN COLONISTS</p><p>AND</p><p>IN RECOGNITION OF THE INVALUABLE ASSISTENCE OF THE WASHOE INDIANS</p>",http://nvshpo.org/historical-markers/77,"<p>Famed Washoe basketmaker, Datsolalee, is buried in this cemetery. Also known as Louisa Keyser, Dat So La Lee, and Dabuda, her 120+ major documented baskets were made expressly for sale to Arts and Crafts collectors from 1895 until her death in 1925 under patronage of the Cohn family. Datsolalee’s baskets are prized by collectors and displayed in museums across the country.</p><p>Utilitarian, straight-walled, decorated coiled willow basketry is a Washoe tradition extending back thousands of years.  Datsolalee introduced the spherical Washoe degikup willow basket with innovative decorative motifs in bracken fern and redbud fibers.  She and her patrons promoted this craft to the public, elevated it to an art form, and, most importantly, motivated basketry production by other tribal members during a period when the Washoe were recovering from mid-nineteenth-century loss of their homelands and aboriginal lifeways.</p>",Carson City," Carson River Basin, Carson City. Located at Snyder Avenue at the Stewart Cemetery, Carson City.",39.11927,-119.75307,2014-11-01 19:06:38 UTC,2014-11-07 00:40:36 UTC
78,78,Orion Clemens Home,"<p>STATE HISTORICAL MARKER No. 78</p>
<p>state historic preservation office</p><p>JULIAN C. SMITH, JR.</p>",http://nvshpo.org/historical-markers/78,"<p>Orion Clemens, secretary to territorial governor James W. Nye, lived in this house with his wife, “Mollie,” from 1864 to 1866.  Samuel, his brother who was a reporter for the Territorial Enterprise, stayed here periodically until leaving the territory in May 1864. He became famous as “Mark Twain.”</p>",Carson City," Carson River Basin, Carson City. Located at North Division and Spear Streets, Carson City.",39.16659,-119.76953,2014-11-01 19:06:38 UTC,2014-11-07 00:40:36 UTC
79,79,Civil War Plot,"<p>STATE HISTORICAL MARKER No. 79</p>
<p>state historic preservation office</p><p>Eva M. Crist McCarthy</p>",http://nvshpo.org/historical-markers/79,"<p>This plot was purchased in 1890 for $180 in gold coin by the General O.M. Mitchel post #89, Grand Army of the Republic, to be used as a last resting place for comrades-in-arms during the Civil War, 1861-1865.</p><p>It became a place of beauty in the early 1900s.</p><p>Following years of neglect and outrageous vandalism, restoration was initiated in 1963 by the Daughters of Union Veterans of the Civil War and other interested citizens of the Reno area.</p><p>Among those buried here are member of the Nevada volunteers who served in their own state and neighboring areas of the West from 1861-1866.</p>",Washoe,"Truckee River Basin, Washoe County. Located at 10th and Angel Streets, in Reno.",39.32168,-119.49192,2014-11-01 19:06:38 UTC,2014-11-07 00:40:36 UTC
80,80,Eureka County Courthouse,"<p>STATE HISTORICAL MARKER No. 80</p>
<p>state historic preservation office</p><p>BOARD OF COUNTY COMMISSIONERS</p>",http://nvshpo.org/historical-markers/80,"<p>Built in 1879-80 of locally-fired brick and of sandstone quarried nearby, the Eureka County courthouse remains a fine example of boomtown Victorian opulence.  This relic, a scene of many famous trials, reflects the glory days when Eureka was the first important lead-silver district in the United States.</p>",Eureka," Central Region, Eureka County Located at the Courthouse in Eureka, Nevada.",39.51243,-115.96098,2014-11-01 19:06:38 UTC,2014-11-07 00:40:36 UTC
81,81,Grand Army of the Republic Memorial Tree,"<p>STATE HISTORICAL MARKER No. 81</p>
<p>Dedicated by Issac Crist camp No. 28, Sons of Union Veterans of the Civil War, Daughters of Union Veterans of the Civil War, Reno, Nevada October 18, 1969.</p>
<p>state historic preservation office</p>",http://nvshpo.org/historical-markers/81,"<p>This tree was planted in soil from Civil War battlefields and dedicated to the memory of the Grand Army of the Republic, by The National Commander in Chief, June 10, 1913.</p>",Washoe,"Truckee River Basin, Washoe County. Located at the intersection of East Ninth Street and North Center Street in Reno.",39.32182,-119.48887,2014-11-01 19:06:38 UTC,2014-11-07 00:40:36 UTC
82,82,Diamond Valley,"<p>STATE HISTORICAL MARKER No. 82</p>
<p>state historic preservation office</p><p>EUREKA COUNTY COMMISSION</p>",http://nvshpo.org/historical-markers/82,"<p>The first known explorer of Diamond Valley was Captain John C. Frémont who mapped the area to aid western migration in 1845.  Before Frémont, Shoshone and Paiute Indians had gathered nature’s bounty here.</p><p>Colonel J.H. Simpson mapped a route through the valley in 1859.  The Simpson route, through the north end of the valley, immediately became the Pony Express route from 1860-1861.  The Overland Telegraph replaced the Pony Express and also crossed the valley.</p><p>Early freight toll roads were operated across the valley as lead and silver mining camps boomed in the 1860s.  Needs of the mining camps gave rise to a limited livestock and dairy industry.  In 1957, a large underground lake was tapped to supply water for irrigation.</p>",Eureka," Central Region, Eureka County. Located on State Route 278, seventeen miles northwest of Eureka, Nevada.",39.30741,-115.57659,2014-11-01 19:06:38 UTC,2014-11-06 15:11:58 UTC
83,83,Rock Creek,"<p>STATE HISTORICAL MARKER No. 83</p><p>AUSTIN CHAMBER OF COMMERCE</p>
<p>state historic preservation office</p>",http://nvshpo.org/historical-markers/83,"<p>(Cold springs station)</p><p>Rock Creek was an important stagecoach stop on the Overland Mail & Stage Company’s historic line along the Simpson route between Salt Lake City and Genoa, Nevada, which was operated by John Butterfield (1861-1866) and later Wells, Fargo & Company (1866-1869).  Fresh horses, blacksmith services, and wagon-repair facilities were available here.</p><p>The Pony Express constructed the Cold Springs station in 1860 on the sagebrush bench eastward across the highway.</p><p>To the north are the ruins of a telegraph repeater and maintenance station which serviced this segment of the transcontinental line, which was completed between Sacramento and Omaha in 1861.  The line was abandoned in August 1869.  The coming of the transcontinental railroad and its parallel telegraph line along the Humboldt River to the north spelled the demise of both the telegraph line and the stage route here.</p>",Churchill," Central Region, Churchill County. Located along U.S. Highway 50 in Edwards Creek Valley.",39.23411,-117.51264,2014-11-01 19:06:38 UTC,2014-11-07 00:40:36 UTC
84,84,Jedediah Strong Smith,"<p>STATE HISTORICAL MARKER No. 84</p><p>STATE HISTORIC PRESERVATION OFFICE</p><p>WHITE PINE PUBLIC MUSEUM, INC.</p>",http://nvshpo.org/historical-markers/84,"<p>EXPLORER OF WESTERN WILDERNESS</p><p>From May to June 1827, Jedediah Smith attempted to find a route from California’s central valley to the Great Salt Lake Valley in Utah, becoming the first European American to completely cross what is now Nevada.</p><p>Because Smith’s journal and map have never been found, his exact route is unknown.  Based on Smith’s own statements about his difficult trip, modern  historians and geographers have pieced together the most plausible route.  Smith crossed the Sierra Nevada at Ebbetts Pass, swung southeast along or across the headwaters and middle reaches of the Walker River, and passed into central Nevada’s trackless waste south of Walker Lake.</p><p>Smith entered Smoky Valley on its southwest side in June 1827 and crossed the valley in a northeasterly direction.  He then paralleled the future Simpson survey, route of the Pony Express and Overland Stage, along modern U.S. Highway 50.</p><p>He entered Utah at Ibapah.</p>",White Pine," Central Region, White Pine County. Located at the rest areas, Alternate U.S. Highway 50, four miles north of Ely.",,,2014-11-01 19:06:38 UTC,2014-11-06 15:11:58 UTC
85,85,Sutro,"<p>STATE HISTORICAL MARKER No. 85</p><p>STATE HISTORIC PRESERVATION OFFICE</p>
<p>JULIA C. BULETTE CHAPTER – E. CLAMPUS VITUS</p>",http://nvshpo.org/historical-markers/85,"<p>Sutro was a town, a tunnel, and a man.  The orderly town was headquarters for the Sutro drainage tunnel.</p><p>Adolph Sutro, German born, came to the Comstock in 1860.  He advocated a drainage tunnel, visualizing development of Comstock ore with this access.</p><p>By 1865, his vision gained approval of state and federal legislation.  However, the mining interests, having at first supported the tunnel, became strongly opposed.</p><p>When construction began in 1869, it was first financed by the mine workers, since the tunnel would presumably improve mine safety.  Later, the funding came from international bankers.</p><p>The main tunnel broke through in 1878.  Lateral tunnels were extended and the project drained, ventilated, and serviced the Comstock as planned. Adolph Sutro soon sold his interest in the tunnel company and returned to San Francisco, where he served as mayor</p>",Lyon," Carson River Basin, Lyon County. Located on U.S. Highway 50, three miles east of Dayton, Nevada.",,,2014-11-01 19:06:38 UTC,2014-11-06 15:11:58 UTC
86,86,Tule Springs,"<p>STATE HISTORICAL MARKER No. 86</p>
<p>state historic preservation office</p>
<p>SOUTHERN NEVADA HISTORICAL SOCIETY</p>
",http://nvshpo.org/historical-markers/86,"<p>Paleontological remains show this area, once covered with sagebrush and bordered with yellow-pine forests, had many springs.  These springs were centers of activity for large mammals. these fossil springs retained artifacts indicating the presence, 14,000 to 11,000 years ago, of several extinct animals: the ground sloth, mammoth, prehistoric horse, and American camel.  The first Nevada record of the extinct giant condor comes from Tule Springs</p><p>Small populations of desert culture people, from about 7,000 years ago to the historic period, depended upon vegetable foods and small game for subsistence</p><p>Late Pleistocene geological stratigraphy in few other areas is as complete and well known.  This site is important in the history of archaeology as the first place where C-14 Radiocarbon dating was used systemically and with verifiable results.</p>",Clark," Colorado River Basin, Clark County Located in Floyd Lamb State Park, ten miles northwest of Las Vega, Nevada.",35.00855,-114.3971,2014-11-01 19:06:38 UTC,2014-11-06 15:11:58 UTC
87,87,Savage Mansion (c. 1863),<p>STATE HISTORIC MARKER No. 87</p><p>STATE HISTORIC PRESERVATION OFFICE</p><p>NEVADA LANDMARK SOCIETY</p>,http://nvshpo.org/historical-markers/87,"<p>This elegant mansion, designed in the French Second Empire style, served as a residence for the superintendent, as well as a mine office for the Savage Mining Company.  The first floor served as the mine office while the upper two stories provided a residence for many successful superintendents.</p><p>Ulysses S. Grant, 18th President of the United States and “General of the Armies,” spoke to the townspeople from the second floor balcony on October 27, 1879, after a town parade in his honor.</p>",Storey," Carson River Basin, Storey County Located on D Street in Virginia City.",39.18321,-119.39062,2014-11-01 19:06:38 UTC,2014-11-07 00:40:36 UTC
88,88,Sparks,<p>STATE HISTORICAL MARKER No. 88</p><p>STATE HISTORIC PRESERVATION OFFICE</p>,http://nvshpo.org/historical-markers/88,"<p>Sparks sprang into existence in 1903 as a new division point on the Southern Pacific Railroad.</p><p>Engaged in straightening and realigning the old Central Pacific trackage across Nevada, the Southern Pacific Company moved its shops and headquarters from Wadsworth to this location.  Employees were assigned lots and their houses were freighted to the new town</p><p>Sparks, originally known as Harriman, came into official existence in April 1904.   In 1905, the state legislature incorporated the town, named in honor of John Sparks, rancher and governor of the state of Nevada.</p><p>Sparks boasted one of the largest roundhouses in the world during the steam era.  It was the western Nevada base for a vast stable of steam locomotives, particularly the famous cab-in-front articulated type known as Mallets.  These huge steamers hauled both freight and passengers over the steep grades of the Sierra between Roseville, California and Sparks.</p><p>DUBY REID POST NO. 30 – AMERICAN LEGION</p>",Washoe,"Truckee River Basin, Washoe County. Located in Deer Park in Sparks.",39.3229,-119.45992,2014-11-01 19:06:38 UTC,2014-11-06 15:11:58 UTC
89,89,Paradise Valley,<p>STATE HISTORICAL MARKER No. 89</p><p>STATE HISTORIC PRESERVATION OFFICE</p>,http://nvshpo.org/historical-markers/89,"<p>Hudson Bay Company’s Peter Skene Ogden traversed Paradise Valley in November 1828.  Settlers came to Paradise Valley in 1863.  Conflicts with local Native Americans started the next year, causing the establishment of Camp Winfield Scott (1866-70) four miles from here.  Paradise Valley farms supplied the nearby Nevada and Idaho territory mines.</p><p>In the original town of Scottsdale (1866), John C. Kemler built the first hotel, now used as a residence.  Renamed Paradise City (1869), the town was a mining supply center from 1878 until 1920.  Later when livestock raising predominated, the town was again renamed, this time “Paradise Valley.”</p>",Humboldt," Humboldt River Basin, Humboldt County. Located at the Post Office in Paradise Valley on State Route 290.",40.58557,-117.43362,2014-11-01 19:06:38 UTC,2014-11-06 15:11:58 UTC
