id,number,title,office_marker_info,official_url,description,county,location_info,latitude,longitude,created_at,updated_at
1,1,Empire and the Carson River Mills,<p>CENTENNIAL MARKER No. 1</p><p>STATE HISTORIC PRESERVATION OFFICE</p>,http://nvshpo.org/historical-markers/1,"<p>When the Comstock Lode was discovered in 1859, the problem of reducing the ore from the fabulously rich Virginia City mines had to be solved.  Mills were built in Gold Canyon and Six Mile Canyon, in Washoe Valley, at Dayton, and on the Carson River which offered the most abundant source of water to operate the mills.</p><p>On the east shore of the river near the town of Empire the first small mill, built in 1860, was later enlarged to become the Mexican.  The site of this mill lies to the southwest.  Other large mills were then constructed farther downstream, spurring the growth of the town of Empire.  Ore was hauled to the mills at first by wagon and later by the famous Virginia and Truckee Railroad built in 1869.  Fortunes in gold and silver were produced in over 40 years of operation by the Carson River mills including the Mexican, Yellow Jacket, Brunswick, Merrimac, Vivian, and Santiago.  Traces of Empire and its mills can still be seen today.</p>",Carson City," Carson River Basin, Dayton Valley, Carson River below Carson City. Located along U.S. Highway 40 4 miles east of Carson City.",39.1876,-119.7061,2014-11-01 19:06:38 UTC,2014-11-07 00:40:36 UTC
2,2,Pioneer Memorial Park,<p>CENTENNIAL MARKER No. 2</p><p>STATE HISTORIC PRESERVATION OFFICE</p>,http://nvshpo.org/historical-markers/2,"<p>This part of the Pioneer Cemetery includes the last resting place of Frank Baud and other of the pioneers who founded Winnemucca, earlier known as French Ford. Baud arrived in 1863 and is one of the men credited with naming the town Winnemucca after the famous Northern Paiute chieftain.</p><p>Baud came with Louis Lay from California to work on the Humboldt canal, a project headed by Dr. A. Gintz and Joseph Ginaca who devised the plan to link Golconda and Mill City by means of a 90-mile canal and provide water for the mills in the area.  It was never completed.  Baud later became a merchant, helped build the Winnemucca Hotel with Louis and Theophile  Lay, was the first postmaster, and gave the town a schoolhouse before his death in 1868.</p>",Humboldt," Humboldt River Basin, Humboldt County Located in Winnemucca, Nevada.",39.11144,-119.42229,2014-11-01 19:06:38 UTC,2014-11-06 14:58:35 UTC
3,3,West End of Hastings Cutoff,<p>CENTENNIAL MARKER No. 3</p><p>STATE HISTORIC PRESERVATION OFFICE</p>,http://nvshpo.org/historical-markers/3,"<p>Across the Humboldt Valley southward from this point a deeply incised canyon opens into a valley.  Through that canyon along the South Fork of the Humboldt River ran the disaster-laden route called the Hastings Cutoff.  It joined the regular Fort Hall route running on both sides of the Humboldt here.</p><p>The canyon was first traversed in 1841 by the Bartleson-Bidwell Party, the earliest organized California emigrant group.  In 1846, Lansford Hastings guided a party through this defile of the South Fork and out along the Humboldt.  The ill-fated Reed Donner Party followed later the same year.</p><p>By 1850, the dangers of the cutoff route were recognized and it was abandoned.</p>",Elko," Humboldt River Basin, Elko County. Located on Interstate Highway 80, ten miles west of Elko at Hunter Interchange.",40.76607,-115.91984,2014-11-01 19:06:38 UTC,2014-11-07 00:40:36 UTC
4,4,Junction House First Settlement,<p>CENTENNIAL MARKER No. 4</p><p>STATE HISTORIC PRESERVATION OFFICE</p>,http://nvshpo.org/historical-markers/4,"<p>One of the busiest crossroads of pioneer Nevada converged at this point, serving many major toll roads of the area.  The earliest emigrants from the east crossed through Truckee Meadows at this point, and by 1853, the intersection was known as Junction House, was the first permanent settlement in this valley and a stopping place for thousands.</p><p>Junction House, later called Andersons, was a station for toll roads of the 1860s including the turnpike to Washoe City, the Myron Lake Road to Oregon, the Geiger Road to Virginia City and the important Henness Pass route to California.</p><p>Governor Sparks bought the property in the late 1890s, and most recently it belonged to cattleman William Moffat.</p>",Washoe,"Truckee River Basin, Washoe CountyLocated at the intersection of South Virginia Street and Peckham Lane in south Reno.",39.29329,-119.47685,2014-11-01 19:06:38 UTC,2014-11-07 00:40:36 UTC
5,5,Pioche,<p>CENTENNIAL MARKER No. 5</p><p>STATE HISTORIC PRESERVATION OFFICE</p>,http://nvshpo.org/historical-markers/5,"<p>Silver ore was discovered in this range of mountains in 1864, but no important development took place until 1869 when mines were opened and the town of Pioche was founded.  Pioche soon became the scene of a wild rush of prospectors and fortune seekers. It gained a reputation in the 1870s for tough gunmen and bitter lawsuits.  Miners had retrieved over five million dollars in ore by 1872, but by 1900, Pioche was nearly a ghost town.</p><p>Designated as the seat of Lincoln County in 1871, Pioche survived hard times as a supply and government center for a vast area.  Beginning in 1937, Pioche enjoyed two decades of profitable lead-zinc mining.</p>",Lincoln," Colorado River Basin, Lincoln County. Located on U.S. Highway 93 Alternate in Pioche, Nevada.",37.55604,-114.26953,2014-11-01 19:06:38 UTC,2014-11-06 14:58:35 UTC
6,6,El Dorado Canyon,<p>CENTENNIAL MARKER No. 6</p><p>STATE HISTORIC PRESERVATION OFFICE</p>,http://nvshpo.org/historical-markers/6,"<p>HEAD OF STEAMBOAT NAVIGATION IN NEVADA</p><p>Eldorado Canyon, the site of a mining boom, runs east from here to the Colorado River.  Prospectors began digging for gold and silver here about 1859, forming the Colorado Mining District.  The three largest mines, the Techatticup, Wall Street, and El Dorado Rand Group, yielded over $6,000,000.</p><p>This portion of the Colorado River was navigable before the construction of Hoover Dam, allowing steamboats and barges to freight goods 350 miles from the Gulf of California to the mouth of Eldorado Canyon and upriver. The steamboat era peaked in the 1860s but continued to the turn of the twentieth century.</p><p>In 1867, the US. Army established an outpost at Eldorado Canyon to secure the riverboat freight and to protect miners in the canyon from Native Americans.  The military abandoned the camp in 1869.  In the 1870s the mines flourished again, producing ore until World War II.</p>",Clark," Colorado River Basin, Clark County Located on U.S. Highway 95 near Nelson, Nevada.",35.42587,-114.49605,2014-11-01 19:06:38 UTC,2014-11-06 14:58:35 UTC
7,7,Dayton,<p>CENTENNIAL MARKER No. 7</p><p>STATE HISTORIC PRESERVATION OFFICE</p>,http://nvshpo.org/historical-markers/7,"<p>Dayton, one of the earliest settlements in Nevada, was first known as a stopping place on the river for California–bound pioneers.  Coming in from the desert, they rested here before continuing westward.</p><p>In 1849, Abner Blackburn found a gold nugget at the mouth of Gold Canyon and prospecting began in the canyon to the north.  Ten years later, this led to the discovery of the fabulous ore deposits at Gold Hill and Virginia City.</p><p>Called by several different names in its early years, the place became Dayton in 1861, named in honor of John Day who laid out the town.</p><p>For many decades Dayton prospered as a mill and trading center. It remained the county seat for Lyon County until 1911.</p>",Lyon," Carson River Basin, Lyon County Located on U.S. Highway 50 at Dayton, Nevada.",39.14106,-119.35217,2014-11-01 19:06:38 UTC,2014-11-07 00:40:36 UTC
8,8,Austin,<p>CENTENNIAL MARKER No. 8</p><p>STATE HISTORIC PRESERVATION OFFICE</p>,http://nvshpo.org/historical-markers/8,"<p>Austin sprang into being after William Talcott discovered silver at this spot on May 2, 1862.  Talcott came from Jacobsville, a stage stop six miles to the west on the Reese River. He was hauling wood out of Pony Canyon, directly below, when he made the strike that set off the famous “Rush to Reese.”</p><p>A town called Clifton flourished briefly in Pony Canyon but fast growing Austin soon took over and became the Lander County seat in 1863. Before the mines began to fail in the 1880s Austin was a substantial city of several thousand people.  From Austin, prospectors fanned out to open many other important mining camps in the Great Basin.</p>",Lander," Humboldt River Basin, Lander County. Located on U.S. Highway 50 in Austin, Nevada.",39.299,-119.04716,2014-11-01 19:06:38 UTC,2014-11-07 00:40:36 UTC
9,9,Copper Country,<p>CENTENNIAL MARKER No. 9</p><p>STATE HISTORIC PRESERVATION OFFICE</p>,http://nvshpo.org/historical-markers/9,"<p>The famed open-pit copper mines of eastern Nevada, including the Liberty Pit, largest in the state, are located two miles south of this point.  Through the first half of the twentieth century, this area produced nearly a billion dollars in copper, gold, and silver.  The huge mounds visible from here are waste rock, which was removed to uncover the ore.</p><p>Two miles east of here, near Lane City, was the Elijah, the first mine discovered in the Robinson Mining District.  Lane City, originally called Mineral City, was settled in 1869 and had a population of 400.  At Mineral City was the Ragsdale Station, one hotel, and a stage station.</p>",White Pine," Central Region, White Pine County Located on U.S. Highway 50 west of Ely.",39.28361111111111,-114.96425,2014-11-01 19:06:38 UTC,2014-11-06 14:58:35 UTC
10,10,Sand Mountain,<p>CENTENNIAL MARKER No. 10</p><p>STATE HISTORIC PRESERVATION OFFICE</p>,http://nvshpo.org/historical-markers/10,"<p>Sand Mountain dominates the Salt Wells Basin and is visible from Mt. Rose peak in the Carson Range 82 miles to the west. The dune is important to off highway vehicle enthusiasts, biologists, Native Americans, and geologists.  Sand Mountain is a sinuous transverse dune derived from Ice Age Lake Lahontan beach sands piled here by southwesterly-trending winds. The dune is the Stillwater Northern Paiutes’ Panitogogwa, a giant rattlesnake traveling to the northeast with the wind to its back. The snake can be heard as it moves toward its hole, a phenomenon geologists associate with “singing” sand dunes. The Sand Mountain blue butterfly is only found here where it is depends on the Kearney buckwheat plant. The dunes clearly marked the location of nearby Sand Springs, improved and mapped in 1859 as a potential emigrant stop by Army Lieutenant James H. Simpson. Sand Springs later served as the location of the Sand Springs Pony Express Station in 1860 and the terminus of the 1866 Fort Churchill and Sand Springs Toll Road.</p>",Churchill," Carson River Basin, Churchill County. Located along U.S. Highway 50, twenty miles east of Fallon, Nevada.",39.27513888888889,-118.41338888888889,2014-11-01 19:06:38 UTC,2014-11-06 14:58:35 UTC
11,11,Eureka,<p>CENTENNIAL MARKER No. 11</p><p>State historic preservation office</p>,http://nvshpo.org/historical-markers/11,"<p>“Eureka!” a miner is said to have exclaimed in September 1864 when he discovered rich ore here – and thus the town was named.  Eureka soon developed the first important lead-silver deposits in the nation, and during the furious boom of the 1880s, it had 16 smelters, over 100 saloons, a population of 10,000 and a railroad – the colorful Eureka and Palisade – that connected with the transcontinental line 90 miles to the north.</p><p>Production began to fall off in 1883, and by 1891, the smelters closed, their sites marked by the huge slag piles at both ends of Main Street.</p>",Eureka," Central Region, Eureka County. Located on U.S. Highway 50 in Eureka, Nevada.",39.49991,-115.95822,2014-11-01 19:06:38 UTC,2014-11-07 00:40:36 UTC
12,12,Nevada's Birthplace,<p>NEVADA CENTENNIAL MARKER No. 12</p><p>STATE HISTORIC PRESERVATION OFFICE</p>,http://nvshpo.org/historical-markers/12,"<p>Carson Valley is the Birthplace of Nevada.  By 1851, people settled at a place they called Mormon Station, renamed Genoa in 1856.  With the early establishment of a post office and local government, the community can lay claim to the title of “Nevada’s first town.”</p><p>Thousands of emigrants moved over the old road skirting the west bank of the Carson River as they prepared to cross the Sierra, feeding their livestock on grass cut along the river.  At Genoa; at Mottsville, settled in 1852; and at Sheridan, settled by Moses Job about ’54; emigrants stopped to enjoy produce of the region’s first gardens.  Pony Express riders used this route in 1860, switching a year later to the shorter Daggett Trail, now Kingsbury Grade.</p>",Douglas," Carson River Basin, Douglas County. Located at the junction of U.S. Highway 395 and State Route 88 just north of Minden, Nevada.",39.00506,-119.76048,2014-11-01 19:06:38 UTC,2014-11-06 14:58:35 UTC
13,13,The Comstock Lode,<p>NEVADA CENTENNIAL MARKER NO. 13</p><p>STATE HISTORIC PRESERVATION OFFICE</p>,http://nvshpo.org/historical-markers/13,"<p>Near this spot was the heart of the Comstock Lode, the fabulous 2 ½ mile deposit of high-grade ore that produced nearly $400,000.00 in silver and gold.  After the discovery in 1859, Virginia City boomed for 20 years, helped bring Nevada into the union in 1864 and to build San Francisco.</p><p>Several major mines operated during the boom.  Their sites are today marked by large yellow dumps, several of which are visible from here – the Sierra Nevada a mile to your left, the Union, Ophir, Con Virginia and, on the high hill to the southeast, the combination.  The Lode was worked from both ends, north up Gold Canyon and south from the Sierra Nevada Utah mines.</p>",Storey," Carson River Basin, Storey County. Located along State Route 341 at Virginia City.",39.18582,-119.38505,2014-11-01 19:06:38 UTC,2014-11-07 00:40:36 UTC
14,14,Goldfield,<p>NEVADA CENTENNIAL MARKER No. 14</p><p>STATE HISTORIC PRESERVATION OFFICE</p>,http://nvshpo.org/historical-markers/14,"<p>For a twenty-year period prior to 1900, mining in Nevada fell into a slump that cast the entire state into a bleak depression and caused the loss of a third of the population.</p><p>The picture brightened overnight following the spectacular strikes in Tonopah and, shortly afterwards, in Goldfield.  Gold ore was discovered here in December 1902 by two Nevada-born prospectors, Harry Stimler and Billy Marsh.  From 1904 to 1918, Goldfield boomed.  The city had a railroad that connected to Las Vegas and a peak population of 20,000, making it Nevada’s largest community at the time.  Between 1903 and 1940 a total of $86,765,044 in precious metals was produced here.</p>",Esmeralda," Central Region, Esmeralda County Located on U.S. Highway 95 in Goldfield, Nevada.",37.70752,-117.23377,2014-11-01 19:06:38 UTC,2014-11-06 14:58:35 UTC
15,15,Tonopah,<p>NEVADA CENTENNIAL MARKER No. 15</p><p>STATE HISTORIC PRESERVATION OFFICE</p>,http://nvshpo.org/historical-markers/15,"<p>Jim Butler, District Attorney of Nye County, is credited with the turn-of-century discovery, which ended a twenty-year slump in Nevada’s economy.  American Indians originally used the name Tonopah for a small spring in the nearby San Antonio Mountains, long before Butler camped in this area in May 1900.  Tonopah became the richest silver producer in the nation and replaced Belmont as the Nye County county seat in 1905.  The mines spawned a railroad, several huge mills, and a bustling population of approximately 10,000.</p><p>The mines faltered in the 1920s, but Tonopah achieved long-lasting fame because of the prominent financial and political leaders it produced.  Many camps and communities followed in the wake of Tonopah’s boom, most of which have become ghost towns.</p>",Nye," Central Region, Nye County. Located on U.S. Highway 95 in Tonopah, Nevada.",38.04017,-117.13744,2014-11-01 19:06:38 UTC,2014-11-07 00:40:36 UTC
16,16,Mineral County,<p>NEVADA CENTENNIAL MARKER No. 16</p><p>STATE HISTORIC PRESERVATION OFFICE</p>,http://nvshpo.org/historical-markers/16,"",Mineral," Walker River Basin, Mineral County Located on U.S. Highway 95 at Walker Lake.",38.41422,-118.46245,2014-11-01 19:06:38 UTC,2014-11-06 14:58:35 UTC
17,17,Pershing County,<p>NEVADA CENTENNIAL MARKER No. 17</p><p>STATE HISTORIC PRESERVATION OFFICE</p>,http://nvshpo.org/historical-markers/17,"<p>Here was a key point on Nevada’s earliest road, the famed Humboldt Trail that brought 165,000 immigrants west in the 1840s and 1850s.  Travelers named this rich valley the Big Meadows.  They stopped here for water and grass before continuing south to cross the dreaded Forty Mile Desert, the most difficult segment on the trail to California.</p><p>Mining began here in the 1850s.  George Lovelock, merchant, rancher and prospector, gave his name to the county seat. The coming of the railroad in 1869 brought new growth to the area.  Pershing County, established in 1919, was previously part of Humboldt County.</p>",Pershing," Humboldt River Basin, Pershing County Located at the Courthouse at Lovelock.",40.10489,-118.28359,2014-11-01 19:06:38 UTC,2014-11-07 00:40:36 UTC
18,18,Pyramid Lake,<p>HISTORICAL MARKER No. 18</p><p>PYRAMID LAKE TRIBAL COUNCIL</p>,http://nvshpo.org/historical-markers/18,"<p>KOOYOOE PANUNADU - Pyramid lake</p><p>America’s most beautiful desert lake is a remnant of ancient Lake Lahontan, which covered some 8,450 square miles in western Nevada during the Ice Age.  Caves and rock shelters along its shore have yielded evidence of Numu (Paiute) people living here for thousands of years</p><p>John C. Frémont came upon the lake on January 10, 1844 and named it for the pyramid-shaped island just off the east shore.  The Numu call the Pyramid formulation Wono.  The Pyramid Lake Indian Reservation was created in 1859.  The history of the Numu people living here has been one of contention with encroaching settlers. With the Numu victory in the first battle of Pyramid Lake, May 12, 1860, more European-American men died than in any prior engagement west of the Mississippi</p><p>Anaho Island, just to the south of the pyramid, was established as a national wildlife refuge in 1913 and is today one of the largest white pelican nesting grounds in North America.</p>",Washoe,"Truckee River Basin, Washoe CountyLocated on State Route 445, the Pyramid Lake Highway from Reno and Sparks, Nevada, overlooking the lake on its western side..",39.29329,-119.47685,2014-11-01 19:06:38 UTC,2014-11-07 00:40:36 UTC
19,19,Ragtown,<p>HISTORICAL MARKER No. 19</p><p>STATE HISTORIC PRESERVATION OFFICE</p><p>CHURCHILL COUNTY MUSEUM COMMITTEE</p>,http://nvshpo.org/historical-markers/19,"<p>Ragtown was never a town. Instead, it was the name of a most welcome oasis and gathering point.  This mecca on the banks of nearby Carson River received its name from the appearance of pioneer laundry spread on every handy bush around.</p><p>The Forty Mile Desert, immediately to the north, was the most dreaded portion of the California Emigrant Trail.  Ragtown was the first water stop after the desert.  To the thirst- crazed emigrants and their animals, no sight was more welcome than the trees lining the Carson River.</p><p>Accounts tell of the moment when the animals first picked up the scent of water—the lifted head, the quickened pace, and finally the mad, frenzied dash to the water’s edge.  Then, emigrants rested for the arduous crossing of the Sierra Nevada that lay ahead.</p><p>In 1854, Asa Kenyon located a trading post near Ragtown, offering goods and supplies to travelers during the 1850s and 1860s.  Ragtown was one of the most important sites on the Carson branch of the California trail.</p>",Churchill," Carson River Basin, Churchill County. Located along U.S. Highway 95 Alternate, one mile east of junction with U.S. Highway 50..",39.50559,-118.91932,2014-11-01 19:06:38 UTC,2014-11-07 00:40:36 UTC
20,20,Columbus,<p>STATE HISTORICAL MARKER No. 20</p><p>STATE HISTORIC PRESERVATION OFFICE</p>,http://nvshpo.org/historical-markers/20,"<p>The remnants of Columbus are located on the edge of the Columbus salt marsh, five miles to the southwest.</p><p>The town was initially settled in 1865, when a quartz mill was erected at the site.  This was a favorable location for a mill, because it was the only spot for several miles around where water was in sufficient quantity for operation.</p><p>The full importance of Columbus was not recognized until 1871, when William Troop discovered borax in the locality.  Shortly thereafter, four borax companies were actively engaged in working the deposits on the marsh.</p><p>Columbus probably enjoyed its most prosperous time in about 1875, when the population was reported to have reached 1,000.  That year, the town had many kinds of business establishments, including a post office and a newspaper, The Borax Miner.</p><p>In 1881, about 100 people were left after the borax operations had practically ceased.  All mining and milling stopped entirely shortly after that time.</p>",Esmeralda," Central Region, Esmeralda County. Located on U.S. Highway 95, nine miles north of Coaldale, Nevada.",38.14944444444444,-117.94800000000001,2014-11-01 19:06:38 UTC,2014-11-06 14:58:36 UTC
21,21,The Humboldt Canal,<p>STATE HISTORICAL MARKER No. 21</p><p>STATE HISTORIC PRESERVATION OFFICE</p>,http://nvshpo.org/historical-markers/21,"<p>The Humboldt Canal, sometimes termed the Old French Canal, coursed southwestward from Preble, near Golconda, toward Mill City.  The present highway crossed it at this point, from whence it ran southerly toward the Humboldt County Courthouse on Bridge and West Fifth Streets.</p><p>The canal was conceived in 1862 by Gintz and Joseph Ginaca.  The waterway, with a projected cost of $160,000, was to be sixty-six miles long, fifteen feet wide and three feet deep, and with a fall of thirty-five feet. Its primary purpose was to supply water for over forty stamp mills planned at and above Mill City, but it was also designed for barge traffic and some irrigation water supply.</p><p>Construction of the canal began in 1863.  Louis Lay, a French emigrant from California, excavated the first segment.  Winnemucca City founder Frank Baud, another Frenchman, worked on the project as a teamster</p><p>About $100,000, largely French capital, was expended in building the Humboldt Canal to the Winnemucca area.  Because of engineering errors and severe seepage problems between Winnemucca and Mill City, that section was never completed or used</p><p>Several portions of the old canal are still visible in the Golconda area, in various sections of Winnemucca, and at Rose Creek, south of the city.</p>",Humboldt," Humboldt River Basin, Humboldt County Located on I-80, East of Winnemucca, Nevada.",40.58557,-117.43362,2014-11-01 19:06:38 UTC,2014-11-07 00:40:36 UTC
22,22,Humboldt River,<p>HISTORICAL MARKER No. 22</p><p>STATE HISTORIC PRESERVATION OFFICE</p><p>NORTHEASTERN NEVADA MUSEUM COMMITTEE</p>,http://nvshpo.org/historical-markers/22,"<p>Peter Skene Ogden discovered the Humboldt River on November 9, 1828 during his fifth Snake Country expedition.  Entering Nevada near present-day Denio, Ogden came southward along the Quinn River and the little Humboldt River.  Emerging on the Humboldt main stem near this site, Ogden explored hundreds of square miles of the Humboldt’s course, left records of his trailblazing in his journal, and drafted the first map of the area.</p><p>Ogden gave the name “Unknown River” to the Humboldt at this time, as he was unsure where it went. After the death of his trapper Joseph Paul, Ogden renamed the stream Paul’s River, then Swampy River, and finally Mary’s River, after the Native American wife of one of his trappers.  In 1833 the Bonneville-Walker fur party named it Barren River.</p><p>Ogden’s or Mary’s River were commonly used names for the Humboldt prior to the 1848 publication of a map of John C. Frémont.</p><p>The Humboldt was the only natural arterial across the Great Basin.  It funneled thousands of emigrants along its valley enroute to the Pacific Coast during the period 1841-1870.</p>",Humboldt," Humboldt River Basin, Humboldt County Located on Interstate Highway 80, eight miles northeast of Winnemucca, Nevada.",41.00999,-117.34409,2014-11-01 19:06:38 UTC,2014-11-07 00:40:36 UTC
23,23,Humboldt House,<p>HISTORICAL MARKER No. 23</p><p>STATE HISTORIC PRESERVATION OFFICE</p>,http://nvshpo.org/historical-markers/23,"<p>Humboldt House or Humboldt Station was originally the point of departure for Humboldt City, Prince Royal, and the mines in that vicinity.  In September 1866, it became a stage stop for the historic William (Hill) Beachey Railroad Stage Lines.</p><p>As the Central Pacific Railhead advanced from eastern California, it reached Humboldt House in September 1868.  From 1869 to 1900, Humboldt House was well known as one of the best eating houses on the Central Pacific Railroad. It was truly an oasis in the great Nevada desert, with good water, fruit, and vegetables. The large grove of trees to the west marks the site of this famous hotel.</p><p>Between 1841 and 1857, 165,000 Americans traveled the California emigrant trail past here.  In 1850, on the dreaded Forty Mile Desert southwest of present day Lovelock, over 9,700 dead animals and 3,000 abandoned vehicles were counted.</p>",Pershing," Humboldt River Basin, Pershing County Located along Interstate Highway 80, thirty-eight miles west of Winnemucca.",40.35555,-118.15059,2014-11-01 19:06:38 UTC,2014-11-07 00:40:36 UTC
