id,number,title,office_marker_info,official_url,description,county,location_info,latitude,longitude,created_at,updated_at
184,184,Ward Charcoal Ovens,<p>State Historical Marker No. 184</p><p>NEVADA STATE PARK SYSTEM</p>,http://nvshpo.org/historical-markers/184,"<p>These ovens were constructed during the mid 1870’s and are larger and of finer construction than most other ovens found in Nevada.  They are 27 feet in diameter and 30 feet high with a capacity of about 35 cords of wood which was burned for a period of 12 days to produce about 50 bushels of good solid charcoal per cord.</p><p>The charcoal was used in the smelters at nearby ward, about 30 to 50 bushels being required to reduce one ton of ore.</p><p>Each filling of one of these ovens required the total tree crop from 5 or 6 acres of land.  During the late 1870’s the hills and mountains around many mining camps were completely stripped of all timber for a radius of up to 35 miles.</p><p>As railroads penetrated the west charcoal was replaced by coke made from coal, and the charcoal industry faded.</p><p>“The real worth of the old charcoal ovens is their historical function in reminding present day Americans of a now-vanished industry, without which the great silver and lead bonanzas of the early west could not have been harvested.” Nell Murbarger.</p>",White Pine," Central Region, White Pine County Located at the Ward Charcoal Ovens Historic State Monument, eleven miles south of Ely.",39.02245,-114.5078,2014-11-01 19:06:38 UTC,2014-11-07 00:40:37 UTC
185,185,McCone's Foundries,<p>State Historical Marker No. 185</p><p>STATE HISTORIC PRESERVATION OFFICE</p><p>DAN INDERMUHL</p>,http://nvshpo.org/historical-markers/185,"<p>In 1862, Mead, McCone, and Tascar established a foundry at Johntown, two miles southeast of here in Gold Canyon.  After two years, they moved their operation to this point and erected a large granite building.  John McCone became the sole proprietor of the foundry in 1866</p><p>A fire on May 15, 1872 left nothing standing but the walls</p><p>McCone then bought the Fulton Foundry in Virginia City and made it the largest in the state.  It employed 110 men at its peak</p><p>Fulton’s manufactured all the early castings of the Virginia and Truckee Railway</p><p>The largest casing (in its time) poured on the Pacific Coast was made at Fulton’s on December 11, 1880</p>",Lyon," Carson River Basin, Lyon County. Located along State Route 342 in Silver City, Nevada.",38.45069,-119.22139,2014-11-01 19:06:38 UTC,2014-11-06 15:11:58 UTC
186,186,Union Hotel and Post Office,<p>POST OFFICE</p><p>State Historical Marker No. 186</p><p>DAYTON HISTORICAL SOCIETY</p><p>State historic preservation office</p><p>“PRIVATE PROPERTY NOT OPEN TO THE PUBLIC”</p>,http://nvshpo.org/historical-markers/186,<p>The original Union Hotel was located across the street.  It was rebuilt here in 1870 after a fire destroyed the old hotel.  The former post office site originally housed the dining room and a barber shop.  The free standing rock wall is the original wall of the overland stage station and Pony Express stop.</p>,Lyon," Carson River Basin, Lyon County Located at the intersection of Main and Pike Streets in Dayton, Nevada.",39.14102,-119.35264,2014-11-01 19:06:38 UTC,2014-11-07 00:40:37 UTC
187,187,The Cattle Industry,"<p>STATE HISTORIC MARKER No. 187</p><p>STATE HISTORIC PRESERVATION OFFICE</p><p>THIS SITE DONATED FOR YOUR ENJOYMENT BY CHARLES B. THORNTON</p><p>ROY L. ASH, OWNERS OF THE T LAZY S RANCH</p>",http://nvshpo.org/historical-markers/187,"<p>The numerous valleys of Nevada have supported a vigorous cattle industry since the 1850s.  Cattlemen ranged their herds throughout northern Nevada by the 1870’s.  The completion of the transcontinental railroad in 1869 was the catalyst that created a prosperous industry.  Longhorns from Texas were driven to fertile valleys for feeding, and then shipped as far as Omaha and San Francisco to market.</p><p>As the mining booms subsided, Nevada’s ranches kept the state alive in the nineteenth century.  Improvements in breeding stock and winter feeding helped build vast ranching empires for hardworking stockmen.  Today, more than ninety percent of Nevada’s cropland is devoted to feed for cattle.  For more than a century, Nevada has been a principal food producer for the nation.</p>",Eureka," Humboldt River Basin, Eureka County. Located at the Beowawe Rest Area along Interstate Highway 80.",40.68688,-116.48305,2014-11-01 19:06:38 UTC,2014-11-07 00:40:37 UTC
188,188,Von Schmidt State Boundary Monument,"<p>State Historical Marker No. 188</p>
<p>State historic preservation office</p><p>Dedicated November 20, 1974 by Needles Chapter of the San Bernadino County Museum Association and the California, Arizona and Nevada Development Association, Can-Do</p>",http://nvshpo.org/historical-markers/188,"<p>This marker commemorates the iron column erected in 1873 at the southernmost tip of the boundary survey line run by Alexey W. Von Schmidt, U.S. astronomer and surveyor.  The line dividing Nevada and California was based on preliminary geodetic work by Lieutenant Joseph Christmas Ives.  Ives determined the Colorado River end of the proposed oblique California-Nevada boundary.  Von Schmidt calculated and ran the first complete survey of the boundary.  His solar observations erred slightly, the actual line now being ¾ mile to the north.</p>",Clark," Colorado River Basin, Clark County. Located on the west bank of the Colorado River on Pew Road north of Needles, Nevada.",35.00855,-114.3971,2014-11-01 19:06:38 UTC,2014-11-06 15:11:58 UTC
189,189,Southern Pacific Railroad Yards,"",http://nvshpo.org/historical-markers/189,"",Washoe,"Truckee River Basin, Washoe County. Located at ""B"" Street and Pyramid Way in Sparks.",39.32082,-119.45157,2014-11-01 19:06:38 UTC,2014-11-07 00:40:37 UTC
190,190,Original Homesite of Pioneer Las Vegan “Pop” Squires 1865-1958,<p>STATE HISTORICAL MARKER No. 190</p><p>STATE HISTORIC PRESERVATION OFFICE</p>,http://nvshpo.org/historical-markers/190,"<p>Charles “Pop” Squires, often referred to as “the Father of Las Vegas,” lived at this location, with his wife Delphine, from 1931 until his death in 1958.</p><p>Squires first arrived in the Las Vegas Valley in February 1905. He and his partners established a lumberyard, a tent hotel, a real estate firm, and the First State Bank. In March 1906, “Pop” assisted in the formation of the Consolidated Power & Telephone Company, bringing electricity and phone service to the new town</p><p>In 1908, Squires and his wife purchased the community’s only newspaper, the Las Vegas Age. Squires campaigned for the creation of Clark County in 1909. He subsequently worked on incorporating Las Vegas into a city. With his wife and the voice of their newspaper, the couple became advocates for women’s suffrage. As a member of the League of the Southwest and the Colorado River Commission, Squires helped advance plans that eventually led to the construction of Hoover Dam.</p><p>Upon “Pop’s” passing, Las Vegas Sun reporter Bob Faiss wrote, “It seems strange that Las Vegas, a modern boomtown … should owe so much to the foresight of one man. But there is little we have today that wasn’t given an initial shove by ‘Pop’ Squires.”</p>",Clark,"Colorado River Basin, Clark County Located on Fremont Street in Las Vegas.",,,2014-11-01 19:06:38 UTC,2014-11-06 15:11:58 UTC
191,191,Verdi,"<p>STATE HISTORICAL MARKER No. 191</p>
<p>STATE HISTORIC PRESERVATION OFFICE</p>
<p>NATIONAL SOCIETY DAUGHTERS OF THE AMERICAN COLONISTS</p>",http://nvshpo.org/historical-markers/191,"<p>Modern Verdi came into being with the construction of the Pacific Railroad through Nevada in 1867-'69.  It became a major mill town and terminal for the shipment of ties and construction timbers, with a network of logging railways reaching into the timber north and west of here.</p><p>In 1860, a log bridge was built across the Truckee river near where Verdi is now located.  Known as O’Neil’s crossing, the site served as a stage stop during the 1860’s on the heavily travelled Henness Pass Turnpike and Toll Road and the Dutch Flat and Donner Lake Road.</p><p>In 1864, the Crystal Peak Company laid out a town on the site some two miles from Verdi’s present location.  The company owned mining and lumbering interests near the settlement which was then called Crystal Peak.</p><p>Verdi remained an active lumbering center into the twentieth century due to the exertions of men like Oliver Lonkey of the Verdi Lumber Company.  A disastrous fire in 1926, plus depletion of timber reserves, resulted in Verdi’s decline.</p>",Washoe,"Truckee River Basin, Washoe CountyLocated at Crystal Peak Park in Verdi.",39.30953,-119.59634,2014-11-01 19:06:38 UTC,2014-11-07 00:40:37 UTC
192,192,Buckland's Station,<p>State Historical Marker No. 192</p><p>STATE HISTORIC PRESERVATION OFFICE</p><p>NATIONAL SOCIETY – DAUGHTERS OF THE AMERICAN COLONISTS</p>,http://nvshpo.org/historical-markers/192,"<p>(ON THE CALIFORNIA EMIGRANT TRAIL)</p><p>Samuel S. Buckland was a true pioneer.  He settled here in 1859, began a ranching operation, established a station for the Overland Stage Company, and operated a tent hotel.  He also constructed the first bridge across the Carson River downstream from Genoa.</p><p>During 1860, Buckland built a large log cabin and married Miss Eliza Prentice.  In that same year, Buckland’s Station served as the assembly point for the volunteer units that took part in the Pyramid Lake War.  It was during this period that Buckland’s served as a remount station on the famous Pony Express route.</p><p>In 1864, Buckland opened a store and dispersed goods to travelers, neighbors, and the soldiers at nearby Fort Churchill.  He later constructed the large two-story house, presently located here, from materials obtained at the dismantling of the fort.</p><p>Buckland and his family are buried at Fort Churchill.</p>",Lyon," Carson River Basin, Lyon County. Located along U.S. Highway 95A at the Carson River.",39.17393,-119.15059,2014-11-01 19:06:38 UTC,2014-11-07 00:40:37 UTC
193,193,Historic Flume and Lumberyard,<p>HISTORIC FLUME</p><p>State Historic Marker No. 193</p><p>STATE HISTORIC PRESERVATION OFFICE</p><p>CARSON CITY HISTORICAL COMMISSION</p>,http://nvshpo.org/historical-markers/193,"<p>Approximately one-half mile south of this point and west of the present highway lay the immense yard of the Carson-Tahoe Lumber and Fluming Company, the greatest of the Comstock timber companies operating in the Lake Tahoe Basin during 1870-1898.</p><p>Situated at the terminus of the 12 mile V flume from Spooners Summit in the Sierra Nevada, the lumberyard was approximately one mile long and one-half mile wide. A spur line of the Virginia and Truckee Railroad served the yard.  The spur ran adjacent to this site and carried rough lumber to the company’s planing mill and box factory, one-half mile north on Stewart Street.  It also transported timbers and cordwood to the Carson yards to be hauled to the Comstock mines and mills.</p>",Carson City," Carson River Basin, Carson City. Located at the rest area on U.S. Highway 395, southern end of Carson City.",39.15191,-119.76643,2014-11-01 19:06:38 UTC,2014-11-07 00:40:37 UTC
194,194,Gardner's Ranch,<p>State Historical Marker No. 194</p><p>STATE HISTORIC PRESERVATION OFFICE</p><p>CARSON CITY HISTORICAL COMMISSION</p>,http://nvshpo.org/historical-markers/194,"<p>From 1870 until 1918, this was the location of the ornate two-story home of Matthew Culbertson Gardner, rancher and lumberman.  The residence was headquarters for Gardner’s 300-acre ranch in the meadows to the south.</p><p>From 1870 to 1898, the Carson-Tahoe Lumber and Fluming Company had a large lumberyard here.  During the 1870s and 1880s, Gardner logged south of Lake Tahoe for the company and built the only standard-gauge logging railroad in the Tahoe Basin. He maintained his home here.</p><p>Gardner died in 1908.  The residence was destroyed by fire on August 20, 1918.  Many of the old trees on the ground once shaded the Gardner family home.</p>",Carson City," Carson River Basin, Carson City Located along U.S. Highway 395, at the south edge of Carson City.",39.1534,-119.7674,2014-11-01 19:06:38 UTC,2014-11-07 00:40:37 UTC
195,195,The Last Spike,"<p>STATE HISTORICAL MARKER No. 195</p>
<p>STATE HISTORIC PRESERVATION OFFICE</p>
<p>UNION PACIFIC RAILROAD CO.</p>",http://nvshpo.org/historical-markers/195,"<p>On January 30, 1905, near this site, workers drove the last spike that completed the railroad between Salt Lake City, Utah and Los Angeles, California.  This was the last “transcontinental” line to southern California and one of the last lines built to the Pacific Coast.  Although there was no formal celebration at the time of the last spike, those present gave some recognition to the event.</p><p>Las Vegas owes its existence to the railroad, then known as the San Pedro, Los Angeles and Salt Lake Railroad. Because the valley had a good supply of water, the railroad company platted the Las Vegas town site and established a division point there.</p>",Clark," Central Region, Clark County. Located off Interstate Highway 15 on Frontage Road, 4.6 miles northeast of Jean, Nevada.",35.50458,-115.16411,2014-11-01 19:06:38 UTC,2014-11-06 15:11:58 UTC
196,196,"The United States Mint at Carson City, Nevada",<p>UNITED STATES MINT</p><p>State Historical Marker No. 196</p><p>STATE HISTORIC PRESERVATION OFFICE</p><p>NEVADA LANDMARK SOCIETY</p>,http://nvshpo.org/historical-markers/196,"<p>The original Carson City building is a formal, balanced, stone edifice, two stories high with a centrally-located cupola.  The sandstone blocks were quarried at the Nevada State Prison.</p><p>On March 3, 1862, Congress passed a bill establishing a branch mint in the Territory of Nevada.</p><p>The gold and silver output of the Comstock Lode coupled with the high bullion transportation costs to San Francisco proved the necessity of a branch in Nevada.</p><p>From its opening in 1870 to the closing of the coin operations in 1893, coinage amounted to $49,274,434.30.</p>",Carson City," Carson River Basin, Carson City. Located at the State Museum in downtown Carson City..",39.16718,-119.76724,2014-11-01 19:06:38 UTC,2014-11-07 00:40:37 UTC
197,197,Arrowhead Trail Henderson,"<p>STATE HISTORICAL MARKER No. 197</p>
<p>Nevada State Park System</p><p>Ben G. Sweet, Jr.</p>",http://nvshpo.org/historical-markers/197,"<p>The name, “Arrowhead Trail” likely originated from the former San Pedro, Los Angeles, and Salt Lake Railroad, which had an arrowhead for a logo.  Prior to 1850, New Mexican trading caravans from Santa Fe en route to Los Angeles used this segment of the Old Spanish Trail.</p><p>Heading south along this trail toward Bishop Mountain, travelers turned through El Dorado pass, and continued to Nelson, Searchlight, Nipton, Wheaton Springs, and on to San Bernardino.</p><p>This section of the trail was popular as an early automobile road (1916-1924) connecting Salt Lake City and Los Angeles.  Local communities along the route promoted its construction and the tourism possibilities of Southern Nevada, including the nearby Valley of Fire, Nevada’s first state park.</p>",Clark," Colorado River Basin, Clark County. Located at the junction of U.S. Highways 93-95, 2.5 miles south of Henderson, Nevada.",35.50458,-115.16411,2014-11-01 19:06:38 UTC,2014-11-06 15:11:58 UTC
198,198,Steamboat Springs,<p>STATE HISTORICAL MARKER No. 198</p><p>STATE HISTORIC PRESERVATION OFFICE</p>,http://nvshpo.org/historical-markers/198,"<p>These natural hot-springs are notable for their curative reputation.  They were acclaimed by President Ulysses S. Grant when he visited in 1879.</p><p>Early emigrants thought they looked like a distant Steamboat because of their puffing and blowing.  Felix Monet located the springs in 1860, and Doctor Joseph Ellis subsequently added a hospital and bathhouses in 1861-1862.</p><p>Comstock mining and the coming of the Virginia & Truckee Railroad in 1871 caused Steamboat to become a terminal. Materials for the silver mines were transferred to freight wagons for the steep haul to Virginia City at this point.  The completion of the tracks abolished the need for a junction, but the resort’s popularity reached its peak with the bonanza days during the 1870s.</p><p>With the failure of the Comstock mines in the 1880s, attendance at the springs waned. Fires destroyed the luxurious buildings, but the therapeutic waters remained.  Health seekers, and conditioning athletes continued to visit here, and the springs even produce mineral muds sought by cosmeticians and race horse owners.</p>",Washoe,"Truckee River Basin, Washoe County, South Truckee MeadowsLocated along U.S. Highway 395, south of Reno, in Steamboat.",39.38,-119.7423888888889,2014-11-01 19:06:38 UTC,2014-11-06 15:11:58 UTC
199,199,Camels in Dayton,<p>State Historical Marker No. 199</p><p>STATE HISTORIC PRESERVATION OFFICE</p><p>DAYTON HISTORICAL SOCIETY</p>,http://nvshpo.org/historical-markers/199,"<p>Camels were imported into the United States for military purposes in the mid-1850s.  Lt. Edward Beale of the U.S.Army tested the animals for possible caravan operations in the deserts of the southwest.  The experiment was not successful and the camels were auctioned off.  Some were brought here to haul wood and salt to the mines and mills of the Comstock.  They were corraled behind this stone building, known as the Leslie Hay Barn. Used extensively between Sacramento and Nevada points for some ten years, the camels were later abandoned to fend for themselves.  Few were seen after the 1880s.</p>",Lyon," Carson River Basin, Lyon County Located along Old U.S. Highway 50 in Dayton, Nevada.",39.14102,-119.35264,2014-11-01 19:06:38 UTC,2014-11-06 15:11:58 UTC
200,200,Hall's Station,<p>State Historical Marker No. 200</p><p>STATE HISTORIC PRESERVATION OFFICE</p><p>DAYTON HISTORICAL SOCIETY</p>,http://nvshpo.org/historical-markers/200,"<p>Spafford Hall built this station and trading post in the early 1850s to accommodate emigrants bound for California.  Hall, who was the first permanent settler here, was severely injured in a hunting accident in 1854 and sold the station to one of his employees, James McMarlin. It became known as McMarlin’s Station.  Major Ormsby bought the station sometime between 1854 and 1860.  The title was still in his name in 1860 when he died in the first battle of the Pyramid Lake War.</p><p>A special niche in Nevada’s history is accorded this site as the place where the first recorded dance was held on New Year’s Eve, 1853. The exact site was destroyed by an excavation for building materials.</p>",Lyon," Carson River Basin, Lyon County Located at the intersection of Main Street and Cemetery Road in Dayton, Nevada.",39.14089,-119.35329,2014-11-01 19:06:38 UTC,2014-11-07 00:40:37 UTC
201,201,Wonder,"<p>HISTORIC MINING CAMP</p><p>STATE HISTORICAL MARKER No. 201</p><p>STATE HISTORIC PRESERVATION OFFICE</p>
<p>DAUGHTERS OF THE AMERICAN COLONISTS</p><p>RENO CHAPTER</p>",http://nvshpo.org/historical-markers/201,"<p>1906 – 1919</p><p>Located 13 miles to the north is the camp of Wonder, a major mining center in the early years of the twentieth century. Thomas J. Stroud and several others made the first locations in March 1906, and in June of that year the Wonder Mining District was organized.</p><p>Wonder’s boom was brief, but spectacular.  Stores and saloons were in operation by mid-summer, 1906, and a school was begun in 1907.  Bench Creek provided water for the camp and an ice plant and a swimming pool made life somewhat more bearable.  During a brief span of years, the Nevada Wonder Mining Company produced some $6,000,000 in silver, gold, copper, and zinc.</p><p>Wonder’s most prominent native daughter is Eva Adams, Administrative Assistant to Senator Patrick A. McCarran for many years and Director of the U.S. Mint during the Kennedy and Johnson administrations.</p>",Churchill," Central Region, Churchill County, Nevada.. Located along U.S. Highway 50, eight miles east of Frenchman..",39.28702777777777,-118.16216666666668,2014-11-01 19:06:38 UTC,2014-11-06 15:11:58 UTC
202,202,Fairview (1905-1917),"<p>STATE HISTORICAL MARKER No. 202</p><p>STATE HISTORIC PRESERVATION OFFICE</p>
<p>DAUGHTERS OF THE AMERICAN COLONISTS</p><p>RENO CHAPTER</p>",http://nvshpo.org/historical-markers/202,"<p>(1 ½ MILES SOUTH)</p><p>Fairview was part of the renewed interest in mining triggered by the strikes in Tonopah and Goldfield.  Discoveries in 1905 of a rich silver deposit led to a boom that lasted through 1907.  A substantial town that boasted hotels, banks, assay offices, 27 saloons, a newspaper, a post office, and a miner’s union hall soon came into being.  By 1908, the boom had passed and production leveled out.  During 1911, the Nevada Hills Mining Company began an era of profitable milling that lasted until 1917.  Production amounted to 3.8 million dollars in silver.</p><p>George Wingfield and George Nixon, prominent Nevada mining promoters of the time, bought some of the first claims in Fairview to give impetus to a boom.</p>",Churchill," Central Region, Churchill County. Located along U.S. Highway 50, six miles east of Frenchman.",39.16995,-118.12895,2014-11-01 19:06:38 UTC,2014-11-07 00:40:37 UTC
203,203,Bullionville,<p>STATE HISTORICAL MARKER No. 203</p><p>STATE HISTORIC PRESERVATION OFFICE</p><p>NEVADA HISTORICAL SOCIETY</p>,http://nvshpo.org/historical-markers/203,"<p>Bullionville was founded in 1870 when John H. Ely and W. H. Raymond removed their five-stamp at Hiko to this point.  The enterprise prospered and during the next two years most of nearby Pioche’s mills were located here because of the proximity to water.  The town grew rapidly, and by 1875 it had five mills, a population of 500, and the first iron foundry in eastern Nevada.  During the same year a water works was constructed at Pioche, which eventually led to the relocation of the mills.  Although a plant was erected here in 1880 to work the tailings deposited by the former mills, the effort failed to prevent the decline of Bullionville.</p>",Lincoln," Colorado River Basin, Lincoln County Located on U.S. Highway 93, one mile north of the junction with State Route 319.",37.48236,-114.24224,2014-11-01 19:06:38 UTC,2014-11-07 00:40:37 UTC
204,204,Jackrabbit,<p>STATE HISTORICAL MARKER No. 204</p><p>STATE HISTORIC PRESERVATION OFFICE</p><p>NEVADA HISTORICAL SOCIETY</p>,http://nvshpo.org/historical-markers/204,"<p>Local legend attributes the discovery of silver here to a person picking up a rock to throw at a jackrabbit and finding himself holding high-grade ore.  The JackRabbit District, named for the mine, was located in 1876 by Isaac Newton Garrison.  Early mine production of the camp, at one time named Royal City, was about ten tons per day, carrying native silver in flakes, yielding about $40 per ton - sometimes as high as $2,000 per ton.  Mineral production declined during the 1880s, but when a fifteen-mile narrow-gauge railroad was opened in 1891 between the Jackrabbit Mine and Pioche, mining soon increased.  After 1893 the mines fell silent except for several short periods of activity in 1906-1907 and 1912-1914</p>",Lincoln," Colorado River Basin, Lincoln County Located fourteen miles north of Pioche on road one mile west of U.S. Highway 93.",38.05436,-114.34562,2014-11-01 19:06:38 UTC,2014-11-07 00:40:37 UTC
205,205,Crystal Springs,<p>STATE HISTORICAL MARKER No. 205</p><p>STATE HISTORIC PRESERVATION OFFICE</p>,http://nvshpo.org/historical-markers/205,"<p>Crystal Springs was designated as the provisional seat for Lincoln County in 1866. With the intention of organizing the new county, Governor Henry G. Blasdel left Carson City in April 1866, accompanied by over twenty people. After a perilous journey through Death Valley, California, they reached the new district of Pahranagat.  Upon arrival at Crystal Springs, the governor found that the region lacked the number of voters necessary to meet the requirements for county organization. A year later the county government organized at Hiko. Crystal Springs used as a watering place and campsite, was the principal stopover on an alternate route of the Mormon Trail.</p>",Lincoln," Colorado River Basin, Lincoln County. Located at the junction of State Route 318 and State Route 375.",37.31962,-115.14012,2014-11-01 19:06:38 UTC,2014-11-06 15:11:58 UTC
206,206,Hiko,<p>STATE HISTORICAL MARKER No. 206</p><p>STATE HISTORIC PRESERVATION OFFICE</p><p>NEVADA HISTORICAL SOCIETY</p>,http://nvshpo.org/historical-markers/206,"<p>As early as 1865, a camp was established here, and during the spring of 1866, W. H. Raymond and others laid out the townsite.  The name Hiko is apparently based on a Shoshone term for “white man” or “white man’s town.”  Raymond purchased a five-stamp mill and had it shipped via the Colorado River to Callville and then hauled by oxen the 140 miles to this site.  In November 1866, milling began on Pahranagat ores and soon after, Hiko became the first county seat of Lincoln County.  In March 1867, Raymond spent nearly $900,000 developing the region before the enterprise failed.  The mill was moved to Bullionville in 1870.  Hiko consequently declined in population and importance, which accelerated following the removal of the county government to Pioche in February 1871.</p>",Lincoln," Colorado River Basin, Lincoln County. Located on State Route 318, five miles north of Crystal Springs, Nevada.",37.31962,-115.14012,2014-11-01 19:06:38 UTC,2014-11-06 15:11:58 UTC
